Category Code,Category Name,Requirement ID Range,Primary Focus,Typical Requirement Types,Example Requirements,Status
GEN,General Airport Infrastructure Compatibility,RQ-85-00-03-GEN-001 to GEN-999,"Runways, taxiways, stands, general airport operations","Physical dimensions, pavement strength, operational procedures","Airport runway requirements, taxiway clearances, stand dimensions",Active
H2,Hydrogen Refuelling Infrastructure,RQ-85-00-03-H2-001 to H2-999,"H₂ storage, delivery, refuelling interfaces, safety zones","Physical interfaces, performance requirements, safety protocols","H₂ refuelling connector standard, supply pressure requirements, safety zones",Active
CO2BAT,CO₂ Battery and Hybrid Storage Interface,RQ-85-00-03-CO2BAT-001 to CO2BAT-999,"CO₂ battery charging, hybrid storage, CO₂ off-loading","Electrical interfaces, thermal management, safety protocols","Battery charging interface, hybrid storage operations, CO₂ containment",Active
ELEC,Electrical Ground Power and Environmental Services,RQ-85-00-03-ELEC-001 to ELEC-999,"Ground power, power quality, environmental control services","Electrical specifications, interface standards, power quality","Ground power interface, power quality limits, environmental control services",Active
PAX,Passenger Boarding Turnaround and Evacuation,RQ-85-00-03-PAX-001 to PAX-999,"Boarding bridges, ground services, evacuation routes","Physical access, operational timing, safety access","Boarding bridge compatibility, turnaround requirements, evacuation routes",Active
DATA,Data Communications and Operational Integration,RQ-85-00-03-DATA-001 to DATA-999,"Data links, operational platforms, DPP integration","Data protocols, bandwidth requirements, cybersecurity","Airport data interface, surveillance interface, DPP integration",Active
EMERG,Emergency Rescue and Safety Services,RQ-85-00-03-EMERG-001 to EMERG-999,"Fire rescue, emergency response, safety corridors","Access routes, emergency procedures, safety equipment","Fire rescue access, H₂ emergency response, safety corridors",Active
